3542	1	2022-07-15 03:58:16	2022-07-15 01:58:16		Quantitative Proteome Landscape of the NCI-60 Cancer Cell Lines.		publish	closed	closed		quantitative-proteome-landscape-of-the-nci-60-cancer-cell-lines			2022-07-15 03:58:16	2022-07-15 01:58:16		0	https://saezlab.org/publication/quantitative-proteome-landscape-of-the-nci-60-cancer-cell-lines/	0	publication		0
3543	1	2022-07-15 03:58:21	2022-07-15 01:58:21		Toward Explainable Anticancer Compound Sensitivity Prediction via Multimodal Attention-Based Convolutional Encoders.		publish	closed	closed		toward-explainable-anticancer-compound-sensitivity-prediction-via-multimodal-attention-based-convolutional-encoders			2022-07-15 03:58:21	2022-07-15 01:58:21		0	https://saezlab.org/publication/toward-explainable-anticancer-compound-sensitivity-prediction-via-multimodal-attention-based-convolutional-encoders/	0	publication		0
3544	1	2021-10-06 05:24:14	2021-10-06 03:24:14		Predicting cellular position in the Drosophila embryo from Single-Cell Transcriptomics data		private	closed	closed		predicting-cellular-position-in-the-drosophila-embryo-from-single-cell-transcriptomics-data-2			2021-10-06 07:04:05	2021-10-06 05:04:05		0	https://saezlab.org/publication/predicting-cellular-position-in-the-drosophila-embryo-from-single-cell-transcriptomics-data-2/	0	publication		0
3545	1	2021-10-06 05:24:20	2021-10-06 03:24:20		Robustness and applicability of functional genomics tools on scRNA-seq data		private	closed	closed		robustness-and-applicability-of-functional-genomics-tools-on-scrna-seq-data-2			2021-10-06 07:04:30	2021-10-06 05:04:30		0	https://saezlab.org/publication/robustness-and-applicability-of-functional-genomics-tools-on-scrna-seq-data-2/	0	publication		0
3546	1	2022-07-15 03:59:27	2022-07-15 01:59:27		Footprint-based functional analysis of multiomic data.		publish	closed	closed		footprint-based-functional-analysis-of-multiomic-data-2			2022-07-15 03:59:27	2022-07-15 01:59:27		0	https://saezlab.org/publication/footprint-based-functional-analysis-of-multiomic-data-2/	0	publication		0
3547	1	2022-07-15 03:59:50	2022-07-15 01:59:50		Prioritization of cancer therapeutic targets using CRISPR-Cas9 screens.		publish	closed	closed		prioritization-of-cancer-therapeutic-targets-using-crispr-cas9-screens-2			2022-07-15 03:59:50	2022-07-15 01:59:50		0	https://saezlab.org/publication/prioritization-of-cancer-therapeutic-targets-using-crispr-cas9-screens-2/	0	publication		0
3548	1	2022-07-15 04:01:31	2022-07-15 02:01:31		<i>In silico</i> Prioritization of Transporter-Drug Relationships From Drug Sensitivity Screens.		publish	closed	closed		in-silico-prioritization-of-transporter-drug-relationships-from-drug-sensitivity-screens			2022-07-15 04:01:31	2022-07-15 02:01:31		0	https://saezlab.org/publication/in-silico-prioritization-of-transporter-drug-relationships-from-drug-sensitivity-screens/	0	publication		0
3549	1	2022-07-15 04:01:53	2022-07-15 02:01:53		How to find the right drug for each patient? Advances and challenges in pharmacogenomics.		publish	closed	closed		how-to-find-the-right-drug-for-each-patient-advances-and-challenges-in-pharmacogenomics			2022-07-15 04:01:53	2022-07-15 02:01:53		0	https://saezlab.org/publication/how-to-find-the-right-drug-for-each-patient-advances-and-challenges-in-pharmacogenomics/	0	publication		0
3550	1	2022-07-15 04:01:57	2022-07-15 02:01:57		Gli1+ Mesenchymal Stromal Cells Are a Key Driver of Bone Marrow Fibrosis and an Important Cellular Therapeutic Target.		publish	closed	closed		gli1-mesenchymal-stromal-cells-are-a-key-driver-of-bone-marrow-fibrosis-and-an-important-cellular-therapeutic-target-2			2022-07-15 04:01:57	2022-07-15 02:01:57		0	https://saezlab.org/publication/gli1-mesenchymal-stromal-cells-are-a-key-driver-of-bone-marrow-fibrosis-and-an-important-cellular-therapeutic-target-2/	0	publication		0
3551	1	2021-10-06 05:25:09	2021-10-06 03:25:09		Rapid proteotyping reveals cancer biology and drug response determinants in the NCI-60 cells		private	closed	closed		rapid-proteotyping-reveals-cancer-biology-and-drug-response-determinants-in-the-nci-60-cells			2021-10-06 07:04:52	2021-10-06 05:04:52		0	https://saezlab.org/publication/rapid-proteotyping-reveals-cancer-biology-and-drug-response-determinants-in-the-nci-60-cells/	0	publication		0
3552	1	2021-10-06 05:25:10	2021-10-06 03:25:10		Open Community Challenge Reveals Molecular Network Modules with Key Roles in Diseases		private	closed	closed		open-community-challenge-reveals-molecular-network-modules-with-key-roles-in-diseases			2021-10-06 07:04:41	2021-10-06 05:04:41		0	https://saezlab.org/publication/open-community-challenge-reveals-molecular-network-modules-with-key-roles-in-diseases/	0	publication		0
3553	1	2021-10-06 05:25:11	2021-10-06 03:25:11		A functional landscape of chronic kidney disease entities from public transcriptomic data		private	closed	closed		a-functional-landscape-of-chronic-kidney-disease-entities-from-public-transcriptomic-data			2021-10-06 06:59:53	2021-10-06 04:59:53		0	https://saezlab.org/publication/a-functional-landscape-of-chronic-kidney-disease-entities-from-public-transcriptomic-data/	0	publication		0
3554	1	2021-10-06 05:25:26	2021-10-06 03:25:26		A cancer pharmacogenomic screen powering crowd-sourced advancement of drug combination prediction		private	closed	closed		a-cancer-pharmacogenomic-screen-powering-crowd-sourced-advancement-of-drug-combination-prediction-3			2021-10-06 07:00:07	2021-10-06 05:00:07		0	https://saezlab.org/publication/a-cancer-pharmacogenomic-screen-powering-crowd-sourced-advancement-of-drug-combination-prediction-3/	0	publication		0
3555	1	2022-07-15 04:06:49	2022-07-15 02:06:49		Drug Resistance Mechanisms in Colorectal Cancer Dissected with Cell Type-Specific Dynamic Logic Models.		publish	closed	closed		drug-resistance-mechanisms-in-colorectal-cancer-dissected-with-cell-type-specific-dynamic-logic-models			2022-07-15 04:06:49	2022-07-15 02:06:49		0	https://saezlab.org/publication/drug-resistance-mechanisms-in-colorectal-cancer-dissected-with-cell-type-specific-dynamic-logic-models/	0	publication		0
3556	1	2021-10-06 05:25:48	2021-10-06 03:25:48		Dissecting cancer resistance to therapies with cell-type-specific dynamic logic models		private	closed	closed		dissecting-cancer-resistance-to-therapies-with-cell-type-specific-dynamic-logic-models-2			2021-10-06 07:02:41	2021-10-06 05:02:41		0	https://saezlab.org/publication/dissecting-cancer-resistance-to-therapies-with-cell-type-specific-dynamic-logic-models-2/	0	publication		0
3557	1	2021-10-04 05:27:59	2021-10-04 03:27:59		Rapid identification of optimal drug combinations for personalized cancer therapy using microfluidics		private	closed	closed		rapid-identification-of-optimal-drug-combinations-for-personalized-cancer-therapy-using-microfluidics-3			2021-10-04 11:55:45	2021-10-04 09:55:45		0	https://saezlab.org/publication/rapid-identification-of-optimal-drug-combinations-for-personalized-cancer-therapy-using-microfluidics-3/	0	publication		0
3558	1	2021-10-05 05:43:22	2021-10-05 03:43:22		Chromosomal rearrangements are commonly post-transcriptionally attenuated in cancer		private	closed	closed		chromosomal-rearrangements-are-commonly-post-transcriptionally-attenuated-in-cancer-2			2021-10-05 18:00:23	2021-10-05 16:00:23		0	https://saezlab.org/publication/chromosomal-rearrangements-are-commonly-post-transcriptionally-attenuated-in-cancer-2/	0	publication		0
3559	1	2022-07-15 04:12:52	2022-07-15 02:12:52		Pharmacogenomic agreement between two cancer cell line data sets.		publish	closed	closed		pharmacogenomic-agreement-between-two-cancer-cell-line-data-sets-2			2022-07-15 04:12:52	2022-07-15 02:12:52		0	https://saezlab.org/publication/pharmacogenomic-agreement-between-two-cancer-cell-line-data-sets-2/	0	publication		0
3560	1	2022-07-15 04:19:11	2022-07-15 02:19:11		Exhaustively characterizing feasible logic models of a signaling network using Answer Set Programming		publish	closed	closed		exhaustively-characterizing-feasible-logic-models-of-a-signaling-network-using-answer-set-programming-2			2022-07-15 04:19:11	2022-07-15 02:19:11		0	https://saezlab.org/publication/exhaustively-characterizing-feasible-logic-models-of-a-signaling-network-using-answer-set-programming-2/	0	publication		0
3561	1	2022-07-15 04:31:13	2022-07-15 02:31:13		Systematic identification of genomic markers of drug sensitivity in cancer cells.		publish	closed	closed		systematic-identification-of-genomic-markers-of-drug-sensitivity-in-cancer-cells-2			2022-07-15 04:31:13	2022-07-15 02:31:13		0	https://saezlab.org/publication/systematic-identification-of-genomic-markers-of-drug-sensitivity-in-cancer-cells-2/	0	publication		0
3562	1	2022-07-15 04:34:54	2022-07-15 02:34:54		Construction of signaling pathways and identification of drug effects on the liver cancer cell HepG2.		publish	closed	closed		construction-of-signaling-pathways-and-identification-of-drug-effects-on-the-liver-cancer-cell-hepg2-2			2022-07-15 04:34:54	2022-07-15 02:34:54		0	https://saezlab.org/publication/construction-of-signaling-pathways-and-identification-of-drug-effects-on-the-liver-cancer-cell-hepg2-2/	0	publication		0
3574	1	2023-11-23 02:52:05	2023-11-23 01:52:05		Systems approach reveals distinct and shared signaling networks of the four PGE2 receptors in T cells.		publish	closed	closed		systems-approach-reveals-distinct-and-shared-signaling-networks-of-the-four-pge2-receptors-in-t-cells			2023-12-04 02:49:30	2023-12-04 01:49:30		0	https://saezlab.org/publication/systems-approach-reveals-distinct-and-shared-signaling-networks-of-the-four-pge2-receptors-in-t-cells/	0	publication		0
3581	1	2023-12-07 02:49:37	2023-12-07 01:49:37		The human hepatocyte TXG-MAPr: gene co-expression network modules to support mechanism-based risk assessment.		publish	closed	closed		the-human-hepatocyte-txg-mapr-gene-co-expression-network-modules-to-support-mechanism-based-risk-assessment			2023-12-07 02:49:37	2023-12-07 01:49:37		0	https://saezlab.org/publication/the-human-hepatocyte-txg-mapr-gene-co-expression-network-modules-to-support-mechanism-based-risk-assessment/	0	publication		0
3582	1	2023-11-22 03:00:12	2023-11-22 02:00:12		COVID19 Disease Map, a computational knowledge repository of virus-host interaction mechanisms.		publish	closed	closed		covid19-disease-map-a-computational-knowledge-repository-of-virus-host-interaction-mechanisms			2023-12-27 02:51:02	2023-12-27 01:51:02		0	https://saezlab.org/publication/covid19-disease-map-a-computational-knowledge-repository-of-virus-host-interaction-mechanisms/	0	publication		0
3583	1	2023-10-18 03:50:47	2023-10-18 01:50:47		Cell-to-cell and type-to-type heterogeneity of signaling networks: insights from the crowd.		publish	closed	closed		cell-to-cell-and-type-to-type-heterogeneity-of-signaling-networks-insights-from-the-crowd			2023-11-21 03:03:23	2023-11-21 02:03:23		0	https://saezlab.org/publication/cell-to-cell-and-type-to-type-heterogeneity-of-signaling-networks-insights-from-the-crowd/	0	publication		0
3596	1	2022-04-28 03:48:39	2022-04-28 01:48:39		decoupleR: Ensemble of computational methods to infer biological activities from omics data		publish	closed	closed		decoupler-ensemble-of-computational-methods-to-infer-biological-activities-from-omics-data			2022-04-28 10:03:38	2022-04-28 08:03:38		0	https://saezlab.org/publication/decoupler-ensemble-of-computational-methods-to-infer-biological-activities-from-omics-data/	0	publication		0
3603	1	2022-01-26 03:23:31	2022-01-26 02:23:31		Correction to: How will artificial intelligence and bioinformatics change our understanding of IgA Nephropathy in the next decade?		private	closed	closed		correction-to-how-will-artificial-intelligence-and-bioinformatics-change-our-understanding-of-iga-nephropathy-in-the-next-decade-2			2022-01-26 09:44:17	2022-01-26 08:44:17		0	https://saezlab.org/publication/correction-to-how-will-artificial-intelligence-and-bioinformatics-change-our-understanding-of-iga-nephropathy-in-the-next-decade-2/	0	publication		0
3604	1	2023-12-07 02:49:35	2023-12-07 01:49:35		MAGED2 controls vasopressin-induced aquaporin-2 expression in collecting duct cells.		publish	closed	closed		maged2-controls-vasopressin-induced-aquaporin-2-expression-in-collecting-duct-cells			2023-12-07 02:49:35	2023-12-07 01:49:35		0	https://saezlab.org/publication/maged2-controls-vasopressin-induced-aquaporin-2-expression-in-collecting-duct-cells/	0	publication		0
3606	1	2023-12-27 02:51:02	2023-12-27 01:51:02		COVID-19 Disease Map, a computational knowledge repository of virus-host interaction mechanisms.		publish	closed	closed		covid-19-disease-map-a-computational-knowledge-repository-of-virus-host-interaction-mechanisms			2023-12-27 02:51:02	2023-12-27 01:51:02		0	https://saezlab.org/publication/covid-19-disease-map-a-computational-knowledge-repository-of-virus-host-interaction-mechanisms/	0	publication		0
3617	1	2023-12-28 02:51:43	2023-12-28 01:51:43		Stabilization but No Functional Influence of HIF-1Î± Expression in the Intestinal Epithelium during Salmonella Typhimurium Infection.		publish	closed	closed		stabilization-but-no-functional-influence-of-hif-1%ce%b1-expression-in-the-intestinal-epithelium-during-salmonella-typhimurium-infection			2023-12-29 02:52:15	2023-12-29 01:52:15		0	https://saezlab.org/publication/stabilization-but-no-functional-influence-of-hif-1%ce%b1-expression-in-the-intestinal-epithelium-during-salmonella-typhimurium-infection/	0	publication		0
3631	1	2024-01-08 03:33:27	2024-01-08 02:33:27		The spatial transcriptomic landscape of the healing mouse intestine following damage.		publish	closed	closed		the-spatial-transcriptomic-landscape-of-the-healing-mouse-intestine-following-damage			2024-01-09 02:52:00	2024-01-09 01:52:00		0	https://saezlab.org/publication/the-spatial-transcriptomic-landscape-of-the-healing-mouse-intestine-following-damage/	0	publication		0
3633	1	2024-01-09 02:52:00	2024-01-09 01:52:00		Patient-specific Boolean models of signalling networks guide personalised treatments.		publish	closed	closed		patient-specific-boolean-models-of-signalling-networks-guide-personalised-treatments			2024-01-10 02:53:19	2024-01-10 01:53:19		0	https://saezlab.org/publication/patient-specific-boolean-models-of-signalling-networks-guide-personalised-treatments/	0	publication		0
3634	1	2024-01-30 02:51:33	2024-01-30 01:51:33		FUNKI: interactive functional footprint-based analysis of omics data.		publish	closed	closed		funki-interactive-functional-footprint-based-analysis-of-omics-data-2			2024-01-30 02:51:33	2024-01-30 01:51:33		0	https://saezlab.org/publication/funki-interactive-functional-footprint-based-analysis-of-omics-data-2/	0	publication		0
3635	1	2024-01-08 03:33:29	2024-01-08 02:33:29		A community challenge for a pancancer drug mechanism of action inference from perturbational profile data.		publish	closed	closed		a-community-challenge-for-a-pancancer-drug-mechanism-of-action-inference-from-perturbational-profile-data			2024-01-08 03:33:29	2024-01-08 02:33:29		0	https://saezlab.org/publication/a-community-challenge-for-a-pancancer-drug-mechanism-of-action-inference-from-perturbational-profile-data/	0	publication		0
3639	1	2024-01-08 03:33:28	2024-01-08 02:33:28		Two heads are better than one: current landscape of integrating QSP and machine learning : An ISoP QSP SIG white paper by the working group on the integration of quantitative systems pharmacology and machine learning.		publish	closed	closed		two-heads-are-better-than-one-current-landscape-of-integrating-qsp-and-machine-learning-an-isop-qsp-sig-white-paper-by-the-working-group-on-the-integration-of-quantitative-systems-pharmacology-and			2024-01-08 03:33:28	2024-01-08 02:33:28		0	https://saezlab.org/publication/two-heads-are-better-than-one-current-landscape-of-integrating-qsp-and-machine-learning-an-isop-qsp-sig-white-paper-by-the-working-group-on-the-integration-of-quantitative-systems-pharmacology-and/	0	publication		0
3641	1	2024-01-12 02:50:39	2024-01-12 01:50:39		Deficiency of myeloid PHD proteins aggravates atherogenesis via macrophage apoptosis and paracrine fibrotic signalling.		publish	closed	closed		deficiency-of-myeloid-phd-proteins-aggravates-atherogenesis-via-macrophage-apoptosis-and-paracrine-fibrotic-signalling			2024-01-29 02:53:55	2024-01-29 01:53:55		0	https://saezlab.org/publication/deficiency-of-myeloid-phd-proteins-aggravates-atherogenesis-via-macrophage-apoptosis-and-paracrine-fibrotic-signalling/	0	publication		0
3642	1	2024-01-11 02:49:45	2024-01-11 01:49:45		Experimental and computational technologies to dissect the kidney at the single-cell level.		publish	closed	closed		experimental-and-computational-technologies-to-dissect-the-kidney-at-the-single-cell-level-2			2024-01-12 02:50:40	2024-01-12 01:50:40		0	https://saezlab.org/publication/experimental-and-computational-technologies-to-dissect-the-kidney-at-the-single-cell-level-2/	0	publication		0
3643	1	2024-01-30 02:51:31	2024-01-30 01:51:31		Molecular consequences of SARS-CoV-2 liver tropism.		publish	closed	closed		molecular-consequences-of-sars-cov-2-liver-tropism			2024-01-30 02:51:31	2024-01-30 01:51:31		0	https://saezlab.org/publication/molecular-consequences-of-sars-cov-2-liver-tropism/	0	publication		0
3644	1	2024-01-30 02:51:31	2024-01-30 01:51:31		Computational drug repurposing against SARS-CoV-2 reveals plasma membrane cholesterol depletion as key factor of antiviral drug activity.		publish	closed	closed		computational-drug-repurposing-against-sars-cov-2-reveals-plasma-membrane-cholesterol-depletion-as-key-factor-of-antiviral-drug-activity-2			2024-01-30 02:51:31	2024-01-30 01:51:31		0	https://saezlab.org/publication/computational-drug-repurposing-against-sars-cov-2-reveals-plasma-membrane-cholesterol-depletion-as-key-factor-of-antiviral-drug-activity-2/	0	publication		0
3645	1	2024-01-30 02:51:30	2024-01-30 01:51:30		Explainable multiview framework for dissecting spatial relationships from highly multiplexed data.		publish	closed	closed		explainable-multiview-framework-for-dissecting-spatial-relationships-from-highly-multiplexed-data			2024-01-30 02:51:30	2024-01-30 01:51:30		0	https://saezlab.org/publication/explainable-multiview-framework-for-dissecting-spatial-relationships-from-highly-multiplexed-data/	0	publication		0
3649	1	2023-12-07 02:49:36	2023-12-07 01:49:36		decoupleR: Ensemble of computational methods to infer biological activities from omics data		publish	closed	closed		decoupler-ensemble-of-computational-methods-to-infer-biological-activities-from-omics-data-2			2024-01-30 02:51:32	2024-01-30 01:51:32		0	https://saezlab.org/publication/decoupler-ensemble-of-computational-methods-to-infer-biological-activities-from-omics-data-2/	0	publication		0
3651	1	2024-01-30 02:51:29	2024-01-30 01:51:29		Mapping the epithelial-immune cell interactome upon infection in the gut and the upper airways.		publish	closed	closed		mapping-the-epithelial-immune-cell-interactome-upon-infection-in-the-gut-and-the-upper-airways			2024-01-30 02:51:29	2024-01-30 01:51:29		0	https://saezlab.org/publication/mapping-the-epithelial-immune-cell-interactome-upon-infection-in-the-gut-and-the-upper-airways/	0	publication		0
3665	1	2024-01-30 02:51:27	2024-01-30 01:51:27		Comparison of methods and resources for cell-cell communication inference from single-cell RNA-Seq data.		publish	closed	closed		comparison-of-methods-and-resources-for-cell-cell-communication-inference-from-single-cell-rna-seq-data			2024-01-30 02:51:27	2024-01-30 01:51:27		0	https://saezlab.org/publication/comparison-of-methods-and-resources-for-cell-cell-communication-inference-from-single-cell-rna-seq-data/	0	publication		0
3667	1	2023-12-15 02:56:27	2023-12-15 01:56:27		Reconstructing the functional effect of<i>TP53</i>somatic mutations on its regulon using causal signalling network modelling		private	closed	closed		reconstructing-the-functional-effect-of-tp53-somatic-mutations-on-its-regulon-using-causal-signalling-network-modelling			2023-12-15 08:49:57	2023-12-15 07:49:57		0	https://saezlab.org/publication/reconstructing-the-functional-effect-of-tp53-somatic-mutations-on-its-regulon-using-causal-signalling-network-modelling/	0	publication		0
3669	1	2024-01-30 02:51:25	2024-01-30 01:51:25		Imbalanced gut microbiota fuels hepatocellular carcinoma development by shaping the hepatic inflammatory microenvironment.		publish	closed	closed		imbalanced-gut-microbiota-fuels-hepatocellular-carcinoma-development-by-shaping-the-hepatic-inflammatory-microenvironment			2024-01-30 02:51:25	2024-01-30 01:51:25		0	https://saezlab.org/publication/imbalanced-gut-microbiota-fuels-hepatocellular-carcinoma-development-by-shaping-the-hepatic-inflammatory-microenvironment/	0	publication		0
3670	1	2023-06-20 03:54:22	2023-06-20 01:54:22		Deep Phosphoproteomic Elucidation of Metformin-Signaling in Heterogenous Colorectal Cancer Cells		private	closed	closed		deep-phosphoproteomic-elucidation-of-metformin-signaling-in-heterogenous-colorectal-cancer-cells			2023-06-20 08:12:15	2023-06-20 06:12:15		0	https://saezlab.org/publication/deep-phosphoproteomic-elucidation-of-metformin-signaling-in-heterogenous-colorectal-cancer-cells/	0	publication		0
3672	1	2024-01-30 02:51:26	2024-01-30 01:51:26		Integrating knowledge and omics to decipher mechanisms via large-scale models of signaling networks.		publish	closed	closed		integrating-knowledge-and-omics-to-decipher-mechanisms-via-large-scale-models-of-signaling-networks			2024-01-30 02:51:26	2024-01-30 01:51:26		0	https://saezlab.org/publication/integrating-knowledge-and-omics-to-decipher-mechanisms-via-large-scale-models-of-signaling-networks/	0	publication		0
3674	1	2023-07-06 03:50:30	2023-07-06 01:50:30		Combi-seq for multiplexed transcriptome-based profiling of drug combinations using deterministic barcoding in single-cell droplets.		publish	closed	closed		combi-seq-for-multiplexed-transcriptome-based-profiling-of-drug-combinations-using-deterministic-barcoding-in-single-cell-droplets			2023-08-23 10:16:41	2023-08-23 08:16:41		0	https://saezlab.org/publication/combi-seq-for-multiplexed-transcriptome-based-profiling-of-drug-combinations-using-deterministic-barcoding-in-single-cell-droplets/	0	publication		0
3679	1	2022-08-15 04:02:57	2022-08-15 02:02:57		Spatial multi-omic map of human myocardial infarction.		publish	closed	closed		spatial-multi-omic-map-of-human-myocardial-infarction			2022-08-15 14:52:15	2022-08-15 12:52:15		0	https://saezlab.org/publication/spatial-multi-omic-map-of-human-myocardial-infarction/	0	publication		0
3689	1	2024-01-30 02:51:23	2024-01-30 01:51:23		Cross-regional homeostatic and reactive glial signatures in multiple sclerosis.		publish	closed	closed		cross-regional-homeostatic-and-reactive-glial-signatures-in-multiple-sclerosis			2024-01-30 02:51:23	2024-01-30 01:51:23		0	https://saezlab.org/publication/cross-regional-homeostatic-and-reactive-glial-signatures-in-multiple-sclerosis/	0	publication		0
3695	1	2024-01-30 02:51:22	2024-01-30 01:51:22		A microfluidic Braille valve platform for on-demand production, combinatorial screening and sorting of chemically distinct droplets.		publish	closed	closed		a-microfluidic-braille-valve-platform-for-on-demand-production-combinatorial-screening-and-sorting-of-chemically-distinct-droplets			2024-01-30 02:51:22	2024-01-30 01:51:22		0	https://saezlab.org/publication/a-microfluidic-braille-valve-platform-for-on-demand-production-combinatorial-screening-and-sorting-of-chemically-distinct-droplets/	0	publication		0
3696	1	2024-01-30 02:51:22	2024-01-30 01:51:22		Adult human kidney organoids originate from CD24+ cells and represent an advanced model for adult polycystic kidney disease.		publish	closed	closed		adult-human-kidney-organoids-originate-from-cd24-cells-and-represent-an-advanced-model-for-adult-polycystic-kidney-disease			2024-01-30 02:51:22	2024-01-30 01:51:22		0	https://saezlab.org/publication/adult-human-kidney-organoids-originate-from-cd24-cells-and-represent-an-advanced-model-for-adult-polycystic-kidney-disease/	0	publication		0
3697	1	2022-11-13 02:57:05	2022-11-13 01:57:05		Explainable multi-view framework for dissecting intercellular signaling from highly multiplexed spatial data		private	closed	closed		explainable-multi-view-framework-for-dissecting-intercellular-signaling-from-highly-multiplexed-spatial-data-2			2022-11-13 16:45:33	2022-11-13 15:45:33		0	https://saezlab.org/publication/explainable-multi-view-framework-for-dissecting-intercellular-signaling-from-highly-multiplexed-spatial-data-2/	0	publication		0
3698	1	2022-11-13 02:57:09	2022-11-13 01:57:09		Cell-cell Communication Inference from Single-cell RNA-Seq Data: a Comparison of Methods and Resources		private	closed	closed		cell-cell-communication-inference-from-single-cell-rna-seq-data-a-comparison-of-methods-and-resources-2			2022-11-13 16:42:44	2022-11-13 15:42:44		0	https://saezlab.org/publication/cell-cell-communication-inference-from-single-cell-rna-seq-data-a-comparison-of-methods-and-resources-2/	0	publication		0
3706	1	2022-11-15 02:51:03	2022-11-15 01:51:03		Spatial cell type mapping of multiple sclerosis lesions		publish	closed	closed		spatial-cell-type-mapping-of-multiple-sclerosis-lesions			2022-11-15 09:53:13	2022-11-15 08:53:13		0	https://saezlab.org/publication/spatial-cell-type-mapping-of-multiple-sclerosis-lesions/	0	publication		0
3707	1	2024-01-30 02:51:24	2024-01-30 01:51:24		Compartments in medulloblastoma with extensive nodularity are connected through differentiation along the granular precursor lineage		publish	closed	closed		compartments-in-medulloblastoma-with-extensive-nodularity-are-connected-through-differentiation-along-the-granular-precursor-lineage			2024-01-30 02:51:24	2024-01-30 01:51:24		0	https://saezlab.org/publication/compartments-in-medulloblastoma-with-extensive-nodularity-are-connected-through-differentiation-along-the-granular-precursor-lineage/	0	publication		0
